emotion,sentence
Sadness,"ước gì mày được quay về tuổi thơ , trước mày cũng có 1 b trai như vậy đó"
Enjoyment,làm kiểu không cần bẻ phê hơn =)))
Disgust,khó tính chảnh chó như mèo 🙄
Surprise,chủ tịch giả vờ nấu kiểu này và cái kết cháy trụi làng
Other,per nhớ thật sự
Sadness,"đấy , nó đấy . con tim tao đau quá ."
Fear,ngày xưa hồi còn học mẫu giáo mỗi lần đi qua là nó rượt tao chạy té khói dume còn thiếu nước chạy lại quỳ xuống van xin nó nữa thôi . đến giờ nó vẫn là nỗi ám ảnh với tao :))
Enjoyment,chính xác là con gái xinh auto đáng yêu =))))
Disgust,vớ vẩn thặc ! marketing cũng có dăm bảy loại và tùy lĩnh vực . dăm ba cái này đăng mà không đọc à
Enjoyment,"kết nhất cái điệu "" xời quá là điều bình thường luôn """
Enjoyment,chàng trai mạnh mẽ !
Fear,thấy hơi sợ sợ rồi đấy :(
Enjoyment,như con đười ươi :))))))
Enjoyment,per thần thái còn phải thua haha
Other,chuẩn bị cho chim ăn cức
Disgust,"có chỗ tự đào thải nhưng có chỗ có đào cũng không thải , vì "" cơ chế "" đồng tiền có lỗ xỏ . khó nói lắm"
Sadness,đang thất tình mà dume cứ bắt đi bán xoài @@
Surprise,đm y chang mẹ tao chửi tao luôn :)
Disgust,trông ô uế vãi
Disgust,đúng rất nguy hiểm ! đằng sau 1 thằng đàn ông đôi khi là cả một tủ váy
Anger,dm đang yên đang lành tự dưng bị nhét cẩu lương 😡😡
Disgust,phản cảm
Enjoyment,"ba mẹ mình nhớ tất cả ngày tháng năm sinh âm lịch , giờ sinh , tên tuổi ...... của 4 chị em ....."
Enjoyment,bị tát lần đầu có thể sẽ hơi sốc một chút nhưng bị nhiều lần rồi sẽ quen ngay ấy mà 😂
Disgust,ghê thật
Sadness,không biết đến 2021 tao có lấy được chồng không nữa :((
Enjoyment,"kỳ nghỉ hè muộn của anh mà , xõa hết đi anh ."
Other,nhỏ không học lớn lên làm nhà báo
Other,2 - 3 tuần gì đấy . sao thế
Anger,per đu ̣ me ̣ như 1 tro ̀ đu ̀ anh =))))) đi gia ̉ mày tô ́ c co ̀ n nhiê ̀ u hơn khu nha ̀ ông
Disgust,dở hơi
Disgust,cũng chỉ là ít protein dạng sợi thôi béo tốt gì mà gìn giữ 66 năm 😑 xã hội giờ là vậy . khi bạn không có tài năng nhưng bạn muốn tạo sự quan tâm của xã hội thì phải ..... 🙃🙃🙃
Other,"đó là những cô gái cần được bảo tồn , vì biết lo nghĩ đến thứ anh ta đang nghĩ"
Other,đó là mày chưa nhận ra việc mày yêu tiền như thế nào và muốn kiếm tiền nhiều bao nhiêu ?
Other,tại thợ hàn bất cẩn chăng ...
Disgust,đúng là không có nhân tính
Enjoyment,"học xong cấp 3 , ngoài mừng vì được thoát khỏi đó thì không hề có lưu luyến 1 chút nào :))))))"
Sadness,hoá ra chúng ta không biết nhiều về tình yêu như ta vẫn nghĩ 😢
Anger,lòng đường không phải nhà cụ nên cụ sai nhé . vỉa hè to vậy rồi cụ còn muốn như thế nào
Surprise,thiệt hả cái ???
Enjoyment,per mi phải học con nay bán hàng lai chim mới chạy hàng này
Sadness,"ước mơ của tao , thích vẽ lắm luôn , nhưng mỗi tội vẽ xong cho lên màu thì lại tệ 🙄"
Enjoyment,dăm ba cái trò nấu cơm này sao làm khó tao .
Sadness,em chân thành nên em tổn thương
Enjoyment,bộ phim này hay từng đoạt giải oscar có lẽ là bộ hay nhất của ấn độ
Other,ủa ? chọn người nào cũng như nhau thôi . vì cả 2 người chắc đéo gì đã thích bạn đâu ? :))
Anger,đcm . mấy hôm này đi đâu cungz thấy chủ tịch . đéo ngán à ?
Enjoyment,hồi đó cấp 2 mà bán đồ lời mấy chục là mừng quýnh lên rồi =)))
Other,và sau đó mẹ mày đánh thức mày dậy 😌
Enjoyment,per đưa anh nè không cần năn nỉ . chỉ cần em cởi hết đồ ra thôi . đúng không
Disgust,bà này hên vãi . bữa bên gò vấp cũng v . nhỏ kia nói chuyện rất đàng hoàng bà này thấy v làm tới mà lỗi sai rành rành . xui đâu có vài bà đi đường nghe không lọt tai hay sao vả cho mấy phát . hả dạ !
Disgust,dm gớm chó thiệt chứ
Sadness,nhớ lại thời đi học xa nhà . bếp dầu ... :(
Anger,trời ơi . giết hết lũ xúc sinh liên quan đi . lũ giết người hàng loạt . yêu cầu thủ tướng đứng ra chỉ đạo vụ việc này cho dân . diệt tận gốc nhổ tận rể lũ súc vật này .😡😡😡😡
Other,sẽ gây sự chú ý . cố tình xuất hiện trước mặt nhưng giả vờ như không quan tâm 😚
Sadness,nản kèo vãi
Other,"vẫn là thụ động , làm sao phải chặn đứng hiện tượng rải đinh ."
Other,"per xuống cấp những vật liệu dễ bị cháy , chắc có thể do chập điện hoặc nguyên nhân gì đó khiến ngọn lửa bắt lên nhanh cộng với gió lớn ."
Enjoyment,để được maiz ngắm nhìn nụ cười đó nên quyết định chỉ crush mà thôi :3
Surprise,thế là .... nổi tiếng sao ?
Anger,hình phạt đó quá nhẹ không có sức dặn đe kẻ khác
Fear,dume nghe kể mà đau cổ họng vãi :)
Fear,khiếp ăn tạp chẳng chết
Enjoyment,một cái tết nhiều tiền
Disgust,phim này thật ra hay nhưng không có tính thực tế . không hay bằng truyện .
Disgust,sao tao ghét mấy cái tiếng cười của bọn khựa vãi mà video lồn nào cũng nge
Other,"giáo viên tiếng anh ở cấp thcs cực kì chán , phát âm sai bét , giao tiếp tiếng anh thì cứ ừ à ."
Disgust,nó còn kể với bạn nó .. bạn nó cũng là bạn mình
Anger,dume tao chửi cho nó sấp mặt luôn chứ còn gì nữa
Enjoyment,cầu trời phật cho đại gia đình con sức khỏe !
Disgust,do chính sách quản lý yếu kém mới ra vậy đó
Enjoyment,con đáng yêu quá
Enjoyment,hồi xưa còn bị vén tà áo dài nằm lên bàn rồi đánh . chứ quỳ thế này có là gì đâu . giờ mới thấy cảm ơn thầy cô vì hồi đó đã như vậy .
Enjoyment,phim nay và phim triệu phú ổ chuột là 2 phim của ấn mà mình thích nhất
Other,:))) bố mày nghi nghi rồi . tắt loa auto sáng suốt :)))
Enjoyment,trời . cưng chết được
Enjoyment,dù chỉ là 1 cây bông nhưng nó là tất cả tình yêu của ông dành cho bà ❤❤❤
Disgust,thằng nào phán sai bỏ tiền túi ra mà đền cho người bị oan sai đừng lấy tiền của nhà nước
Enjoyment,chỉ để nhìn cái thôi :))
Anger,"thôi , không tranh luận với các ông . thế đi đường gặp thằng nào đỗ thế này cả nửa ngày , mà tắc đường và gọi nó không được , các ông đừng há mồm ra dume nó nhé . vì nó đúng mà"
Surprise,2 thằng chúng mày lại không làm gì được ư ?
Enjoyment,chai này mới ghi được nhìu chữ kkk
Other,không biết mình có được may mắn như cụ bà này không
Surprise,mũ sơ sài mà hiệu quả vãi
Disgust,"per nghe đồn mày yêu mèo , mà sao mày không đáng yêu :))"
Fear,đcm ác mộng
Fear,per gặp tao chắc tao đái trong vần 😅😅
Disgust,mấy thằng súc vật 😡
Anger,cáu vãi :)))
Other,per bảo sao tao cứ muốn nghỉ việc . lm với cái tao sờ choét lắm
Enjoyment,""" vậy là đủ tuổi ngồi tù rồi nhỉ ?"" , mặt anh rất tỉnh và đẹp zai =))"
Other,giống chó này tên là gì vậy các bác 🙄
Sadness,làm bộ mặt ngầu cho thằng thỏ để ý mà thằng này láo ăn thiệt đéo cho mình ăn ké quê thiệt là quê luôn
Enjoyment,tao thấy dễ thương màaaa
Enjoyment,cách người ta phản ứng cũng văn minh ghê ❤️
Sadness,"per 😥 cảm thấy tội lỗi quá , từ nay không chụp nữa thiệt luôn"
Disgust,em mà biết nó vô văn hóa thế thì em cũng làm cách này luôn cho nó nhanh ah :-)
Other,per hồi lớp 1 tao quên nhãn vở mỹ thuật sợ đánh quá ngồi khóc tè le
Enjoyment,cảm ơn các anh tình nguyện viên .
Enjoyment,thật tuyệt vời !
Enjoyment,3 thằng ngốc . xem ý nghĩa lắm
Enjoyment,dễ thương quá !!!
Anger,"thì đi ra chỗ khác viết , đụ mẹ coi mà tao tức á ."
Enjoyment,bà ngoại của em đáng yêu hơn thế này nhiều
Anger,đem hủy mẹ đi . đấu giá cái quần què gì xong thằng mua lại nó hứng nó cho cả thế giới dính vr cmnl .
Fear,đã sợ rồi .. cố gắng hí mắt để xa ra để coi như thế nào .. khúc cuối hết hồn dục luôn cái điện thoại :)))
Enjoyment,tao thấy cảm động vãi .
Fear,cũng sợ mấy con ngoe nguẩy như giòi 😰
Sadness,đáng lẽ bệnh của tao đã không nặng đến thế
Surprise,đẹp khó tin quá
Enjoyment,xấu mà đáng yêuc quá
Other,"t xem cái này từ lâu lâu lâu rồi cơ , đéo bất ngờ gì cạ 😕"
Surprise,duới miền tây là kiến vàng sao ngoài ấy lại dùng kiến đen nhỉ ?
Surprise,xưa dữ luôn
Disgust,"con cái có hư hỏng thì cha mẹ phải dạy dỗ , chứ cái loại thờ ơ khi con mình hư hỏng thế này thì đúng là dột từ nóc rồi ."
Enjoyment,mê trai hơn bạn có thật :(
Enjoyment,má toàn truyện trong mơ không hà mắc cười quá 😂
Disgust,per khóc quá trời rủ họp lớp đéo thấy đâu
Enjoyment,phim ấn thì của lão amir khan là hay vol
Enjoyment,"cha quay phim cũng không phải dạng vừa , mẹ diễn viên thần thái vãi"
Sadness,ơ thế hoá ra tao không bị ngu một mình ?
Enjoyment,"động lực là lo được cho gdinh , tự chủ bản thân"
Enjoyment,nhìn nữa sao . hỏng yêu đi . cho doi . vui vẻ
Disgust,trời đất . 580k không tiếc thì tiếc gì trời . người ta làm ăn đàng hoàng . hứa hươu hứa vượn . là người lớn mà làm trò mất nết vậy trời @@
Enjoyment,cảm ơn bạn vì đã chia sẻ cũng như đã luôn sáng suốt để không làm gì sai
Enjoyment,"rất dũng cảm , đáng yêu quá"
Enjoyment,nhà tao còn nè
Enjoyment,dễ thương quá hà
Disgust,"như mọi năm thôi mưa gió rét mướt , bây giờ mót ỉa là chỉ có thánh mới giúp được"
Enjoyment,đọan con chó tao cười đau bụng
Enjoyment,đó cũng là giải pháp hay để lừa một thèn ngu :)))
Fear,tao lại sợ ngôn tình quá cơ 😒
Other,per ít bữa dẫn mày xem cái này
Other,lên báo sớm thôi nhỉ
Disgust,tỏ tình cho nó biết thôi chứ yêu đương gì tầm này :(((
Enjoyment,cầu mong những công ơn sinh thành luôn mạnh khỏe .
Disgust,cái miệng nó nhanh hơn cái não
Disgust,thành phố tao nhiều người còn dân trí thấp là sao ? bố con dở người
Other,per giống súp lơ của bạn mình
Fear,"k có con gì ác bằng con người , các con bé như thế mà nó không tha"
Other,chi phí kiểm toán và thuê người tổ chức hòa giải chia chác thôi
Anger,thêm cả trò mắt mèo khốn nạn nữa
Sadness,ăn ở cái gì huhu
Enjoyment,nhiều lúc ngáo ngáo thoải mái đến mức người yêu cũng đéo bằng nó và đến khi nó thổ lộ tình cảm thì tao đéo tin :v
Disgust,vẫn bình thường chán làm khách sạn nhọc nhục hơn 👻👻 xoạc nhau nước nôi máu me be bét ra 😭 kinh chết mẹ 😶
Anger,đúng là khốn nạn mà
Enjoyment,ôi hạnh phúc quá 😄😄😄
Sadness,"per hồi học đại học , điện hỏi xin tiền bố , bố ra ngân hàng gửi tiền rồi điện em hỏi stk rồi hỏi "" tên mày là gì ??"" 😭😭"
Sadness,đúng . biết là sự thật tàn nhẫn nhưng vẫn muốn biết rõ cho nhẹ lòng hơn :(
Surprise,mấy kiếp tu luyện mà có 5 triệu thôi à ?
Sadness,đau còn hơn tỏ tình bị từ chối per
Enjoyment,dễ thương vãi ♥♥♥
Fear,bố mày đã sợ nhện rồi xem cái video này ... vãi đái :(((
Enjoyment,bà xinh thật sự ❤️
Surprise,đây là hội à mày ? làm tao phải lên gg tra sao lại đông người thế :))
Other,lại khoe có người yêu - _ -
Disgust,đừng trao duyên cho tao khi chưa biết rõ tao :(
Sadness,chưa có cơ hội nói cảm ơn và xin lỗi . vì chúng ta xứng đáng được bình yên
Other,đáng nhẽ nên làm việc này từ sớm . chứ hàn quốc họ làm từ lâu rồi ạ
Sadness,"quá bản lĩnh luôn , người đáng nể , tiếc là anh ấy sắp bị tử hình rồi"
Disgust,không biết mấy ba mấy mẹ chơi bửa đó có xem được bài viết này không 😂😂😂... có ai lên incon phẫn nộ thì hiểu rồi ha
Enjoyment,góp phần xây dựng đất nước chứ gì kkk đóng nhiếu rứa
Anger,"đm hồi đó nhà có nuôi bốn con , bữa đang ngồi chơi nặn đất sét nó chạy cả lũ tới , thật sự là tao không biết con đéo nào nhma có một con trong đó kéo áo phía sau lưng tao lên rồi cả lũ cắn lưng tao dume nó thốn vãi luôn . thề !"
Disgust,cải ngu lắm ... chưa ai ngu như cải tao thì không yêu đi yêu đứa vừa béo vừa lắm lông
Disgust,toàn lũ đầu trâu mặt ngựa
Enjoyment,làm tao liên tưởng đển phượng hoàng cổ trấn :)))
Other,cố gắng đi gần người ta 1 xíu . rồi lướt qua nhau như 1 cơn gió
Disgust,chơi vậy ai chơi
Sadness,per thì tốt nhỉ quá đỉnh luôn ... nhưng không biết được trọng dụng không nữa buồn quá
Anger,đồ điên
Enjoyment,tự nhiên muốn có con 😐 dume
Enjoyment,cảm động người thầy đưa học sinh đi làm hồ sơ 🙄
Other,đúng là lợi ích kinh tế lâu dài .
Other,thái bình nắng to rồi
Disgust,nói như việt nam . nhưng hơi láo cá chắc thầy của ônc cũng như ông
Other,lò xô xài bằng dầu lửa con gọi là dầu thôi
Fear,đi đường buổi đêm nhìn thấy hãi vãi ??
Disgust,nặng tay cho chừa cái tật hại người
Sadness,"ngàn cân treo sợi tóc nhỉ , csong mong manh quá"
Enjoyment,ko 1 từ nào để diễn tả bộ phim này ...
Fear,"nhỏ thấy qua 1 lần , nó bị cột ngay trước cửa nhà người ta ở trong hẻm , mỗi lần đi ngang qua là nó lại định lao tới cà khịa"
Enjoyment,cười ị :v
Sadness,bởi vì gặp nhau sai thời điểm nên tôi mất người mãi mãi ...
Sadness,gia đình thì không còn . tình yêu thì chưa có gì chắc chắn . 😏
Other,"chỉ cần bạn dùng tình yêu thương , sự chân thành của mình đối với nó thì không gì là không thể ."
Disgust,disme tao chưa thấy con họa mi nào hót dở như con này luôn á .🤔🤔
Enjoyment,"muốn em vui vẻ đơn giản lắm , chỉ cần bao ăn bao xem phim tuần 1 lần thôi hỡi các đồng nghiệp ơiii 🤣"
Enjoyment,hay ý nghĩa sâu sắc 🙂
Disgust,trẻ trâu quá đông và nguy hiểm
Other,chắc chắn là vị mặn của mồ hôi
Other,mày uống trà sữa thôi . đéo ăn gì nữa =))
Other,tất cả cùng không tính điểm . thế là xong :v
Other,nó cũng làm thế với bao người khác đấy
Sadness,quay vào ô mất lượt :))
Other,"mình đã xem rất nhiều video như này rồi , nên thấy cũng bình thường =)))"
Fear,"sợ nhất mấy đứa ảo tưởng sức mạnh , nhắn tin nhiều chút là auto mình thích nó"
Fear,chắc từ giờ tao đéo giám ho nữa quá .
Disgust,đm mưa đâu đéo thấy . nóng vãi
Fear,per không cho anh đi tập đâu nha mất bồ như chơi
Enjoyment,đối với thế giới này bà lão chỉ là một ai đó . nhưng đối với ông lão đó bà lão là cả thế giới 😊
Other,"per haha nhiều tiền quá mang đây tao tiêu hộ cho , đóng thuế 10 củ phí quá =))"
Sadness,"trời đụ , tội bé"
Disgust,có lưu luyến thì lưu luyến người mình thích chứ lưu luyến gì cái trường đấy 😶
Disgust,"đụ mẹ tục , cuối tuần về ra nha :))"
Sadness,nốt hôm nay thui . thui không ngĩ đến và bắt đầu từ bỏ 1 thói quen
Enjoyment,uiii xinh gái thế ...
Disgust,chạy 200tr là vào biên chế ngay . thực trạng chung . cần gì có chuyên môn hay không
Anger,vì đồng tiền mà chúng mày giết bao nhiêu gia đình . chúng mày ăn những đồng tiền đấy mà chúng mày cũng nuốt trôi được à . bọn khốn nạn
Anger,cảm ơn các anh chị báo chí phóng viên đã đưa tin . mong cơ quan chức năng hãy làm thật nghiêm . thật mạnh tay vụ này . đến khổ mấy đứa nhỏ . mưa rét thế này . càng nghĩ càng tức .
Sadness,c trai như thế nào tuyệt chủng rồi :)
Sadness,per ngóng cuộc đấu tranh công nghệ này . tq đồng lòng ghê nhỉ
Sadness,nước mình chả í thức gì cả xả rác bừa bãi để trôi rác đầy đường thể này thật buồn
Disgust,nhờn :)))
Enjoyment,"năm nay mua cân na về nhà ăn dần , tối ra đường xem chúng nó dẫn vợ thằng khác đi chơi ... kaka"
Disgust,tiền bồi thường lấy ở đâu ? cứ làm bừa làm ẩu rồi lấy tiền của dân mà đền đề nghị sửa lại nếu ai làm sai thì bỏ tiền túi ra mà đền
Fear,điềm báo gì đây
Enjoyment,siêu phẩm để đời .
Enjoyment,tao phải công nhận là nó giỏi vãi . từ đứa diễn đến đứa quay và edit video .. giỏi vãi 🤣
Enjoyment,per trai hay gái thì vẫn thấy tữn như thường kk
Other,động lực cho tôi tiếp tục .
Enjoyment,"thôi bảo em gái xuống ngủ với mẹ đi , còn em percó sợ ma không ? thì ngủ với anh . hehe"
Other,đã nuôi thì nên chăm sóc bé cẩn thận ??
Sadness,quê vải mà chưa được ăn quả nào . huhu
Sadness,"mới đây thôi mà đa 3 năm rồi , những ngày chia tay buồn đó :(("
Disgust,"ý thức đéo gì đâu , từ già đến trẻ luôn 😥"
Other,"tao cũng vậy , mấy cái thiệp chúc noel thời cấp 2 trẻ trâu của lũ bạn vẫn còn nguyên xi"
Enjoyment,per haha . đặt bánh thì đặt thành cặp nhé . haha .😂😂
Disgust,thể loại này next sớm đi em
Disgust,làm chung với con mẹ ngáo là phải chuyển đi liền :) per ngọc kiều dung
Other,per ta nguyện nằm im
Other,thôi nhà đang yên ổn
Disgust,"chưa học cách kiếm tiền đã học thói đi lừa tiền =,= thua"
Enjoyment,t tin crush của tao không bị thịt vì tao đéo crush ai cả =))
Disgust,con mẹ kia có vấn đề về thần kinh :) không cần biết ai đúng ai sai nhưng đéo lịch sự thì đã đéo có tư cách nói chuyện rồi :) con bà kia xem được video chắc buồn làm
Enjoyment,ai chưa xem thì nên xem 1 lần đi . đảm bảo không phí 3h đồng hồ của các bạn 😃
Enjoyment,chơi cái kiểu này nè :)) per
Disgust,đéo mẹ . nhìn nổi da gà ..
Sadness,đó là một câu chuyện buồn
Other,cười trước nỗi đau của người khác
Other,có ai biết 2 người này không ạ ?
Enjoyment,per coi đoạn con chó chết cười luôn em :))
Other,chủ tịch lén lút dùng đồ của vợ làm vlog và cái kết ?
Enjoyment,chúc mừng anh 👏👏👏 chúc anh may mắn . cố lênnnnn 💪💪💪
Enjoyment,phê thật . cái tai nó đang thâm đen xì lấy ra hết lại trắng hồng luôn
Anger,do cái áo . mặc giống nhau làm đíuu gì
Disgust,tội còn nặng hơn cả khẩu nghiệp nữa 😌😌😌
Enjoyment,hồi xưa anh hay bị chửi trẻ trâu này nọ ... giờ anh là tổng giám đốc rồi 😁😎
Disgust,nv thu nhâ ̣ p cao thi ̀ hu ́ tao ma ́ u ngươ ̀ i dân phi ́ cao hơn hê ́ tao .
Sadness,người tài như vậy lại không được sử dụng đúng mục đích … quá buồn
Disgust,một câu chuyện cổ tích xiaolon đầy tính nhân văn !!!
Sadness,còn chả có ai nói chuyện thân thiết quan tâm đến tôi :<
Enjoyment,đoạn phỏng vấn + xin đi chụp hình + cạo râu lão là hay nhất theo mình =]]
Enjoyment,coi thôi cũng đủ nghiện rồi 💋
Sadness,năm nào cũng phải ở nhà trông nhà :((
Enjoyment,idol có skill mới chất quá 😂 1 cú đánh mông thôi mà đối thủ bay sấp mặt luôn luôn 🤣
Disgust,"hy vọng cơ quan điều tra làm rõ được danh tính người phụ nữ , chỉ vì cái miệng mà làm tan nát cả 1 gia đình"
Disgust,tấu hài cực mạnh
Anger,con đĩ mất dại . trời đánh tránh bữa ăn nha con ml
Enjoyment,cười xĩu
Sadness,mẹ nó chứ xem xong mình khóc hết cả nước mắt
Disgust,có tiền chưa mà đòi
Disgust,"một hình ảnh hay nhưng một loại âm thanh rất chối tai , câu đầu tiên đã chửi thể và tiếp theo cũng vậy , rất vô văn hóa ."
Sadness,mình chụp mấy lần liền chả thấy bác sĩ cho mặc lớp áo gì cả 😭😭😭
Disgust,thề đi ngoài đường giờ nhiều người lớn cứ nghĩ mình mình già rồi thích đi như nào thì đi . xong quay sang chửi bọn thanh niên là đi đứng mất dạy này nọ . chán . mang tiếng người lớn mà cư xử chán đcđ .
Sadness,trường gửi điểm về và mẹ cũng điện chửi :(
Other,ngày nay bã đã thay cho thính :)))
Other,thế sao tao hát tệ thế này
Disgust,còn đồng nghiệp hãm lờ thì ...
Disgust,"nếu nói chị thảo tham thì chưa thoả đáng , vì ngay cả con chị cũng được niêm yết , định giá để “ chia chác ” ý kiến cá nhân mình , chỉ chia phần của chị và phần % của những người con sẽ được nhận vào 18 tuổi"
Enjoyment,chỉ cần 1 cây hoa . nói lên tất cả .. hi
Disgust,ngày xưa đi học văn và toán chắc noa dưới trung bình hết
Disgust,t lên facebook không phải để coi mấy cái thứ này 😪
Enjoyment,dễ thương quá à ????????
Sadness,làm khách đi qua lại mắc mệt lun
Other,trả lại tuổi thơ cho tao 😆
Anger,để con mẹ mày tiếng bình thường nghe cho dễ . lại còn làm đéo đéo
Enjoyment,chỗ tao cũng có cây tình yêu < 3
Other,ngày nào cũng bị tụi siêu thị hành không dưới 10 lần
Disgust,qua câu chuyện này mong mọi người đừng có cái nhìn ác cảm về các anh csgt về việc hay núp lùm bắt xe nữa mà còn nghệ thuật ăn nói kể chuyện xạolin đẳng cấp 🙂🙂🙂
Disgust,việc nhỏ như vậy mà hai con này hàng sử thiếu văn hóa quá quá
Enjoyment,thỉnh thoảng lại xem lại phim này quá hay và ý nghĩa
Disgust,"lúc đầu tưởng con ma , nó đi tẩy trang xong hiện nguyên hình đếu phải ma mà là con quỷ cái"
Sadness,2 đg thẳng mãi mãi song song không bao giờ cắt nhau hix hix
Other,mai chơi trò hứng nước mà nóng quá chắc chơi vầy luôn
Sadness,per chơi với con trai riết nên giờ đéo có người yêu nổi vì tính tình không khác gì con trai
Fear,đm chơi mất dạy vãi . tưởng khúc cuối là gì dume làm giật mình 😒😒😒
Disgust,"các bạn trẻ thấy cái gì cũng có mặt : giờ trái đất có , thử thách nhặt rác có , vứt rác bừa bãi có . toàn thấy các trẻ ( trâu ) tham gia ."
Fear,chạy ngay đi 😱😱😱 sợ quá .
Fear,"😔 tao không lấy chồng nữa , ở nhà nấu cơm cho mẹ , tao sợ lắm"
Enjoyment,"bữa tao coi cái video này nhưng nó ghép nhạc bựa vãi ... mỗi lần mỗi anh té là first blood , double kill ,... các kiểu =))))"
Enjoyment,chính xác ! chỉ cần đồng nghiệp tốt thì mọi ngày đi làm đều vui 😊😊😊
Enjoyment,đơn giản nha .. cơm này ngon hơn cơm điện nhiều . không tin thì cứ thử
Disgust,làm công thì chấp nhận . chỉ trách khách không ý tứ chứ quyền gì cấm nó đem mấy cái này vào ... có trách thì trách bản thân không có khả năng làm việc khác ngoài làm nhân viên vệ sinh
Surprise,per anh tập gym cho to để như thế nào ư : )))
Other,nhìn cái đống lúa phơi mưa ướt nhẹp ma ghép cười được .
Enjoyment,đã sáng suốt hơn năm ngoái nhiều . ka ka
Anger,vậy nếu mình lên cơn điên và giết người khác thì nỗi đau gấp bội phải không ?
Anger,lòng đường là để giao thông chứ để nhà các bác đỗ xe à ?
Sadness,mình không áo mưa rồi 😞
Other,giọng không nhìn màn hình tao tưởng là ông bà già nào trên 60 tuổi đang nói á .
Sadness,nhưng nói thì cứ bảo hay than thở 😢
Disgust,xiaolin không có gì vui . chúng ta không nên xiaolin 🙄🙄
Sadness,còn tao mỗi lần cắt tóc là y như rằng … nó tệ vãi :(
Enjoyment,được . đỡ tốn 5 nghìn
Enjoyment,"replay chục lần đoạn cuối , phê quá"
Enjoyment,đáng yêu quá ! tình yêu ông bà thật đẹp !
Fear,đứng tim luôn
Sadness,vì bạn chỉ là con trai nắng hoặc em gái mưa thô :(
Sadness,đau nếu còn nghĩ về nhau thì hãy quay về bên nhau :))
